{
	"slug": "north-las-vegas",
	"generated": {
		"by": "bootstrap-research.py",
		"note": "Scaffolded from the existing corpus by bootstrap-research.py. NO EXTERNAL RESEARCH WAS PERFORMED. Every item is marked with the evidence level it actually has; nothing here may be treated as verified until a researcher answers the open questions and records a real source.",
		"research_pass": {
			"on": "2026-09-14",
			"by": "North Las Vegas research",
			"note": "Two claims added, neither publishable. NRS 487.290 rests on a secondary publisher and is statewide in any case; the city-code claim establishes only that a code exists."
		}
	},
	"claims": [
		{
			"id": "north-las-vegas-00-free-towing-day-pickup",
			"claim": "Free towing, same-day pickup, and cash on the spot for vehicles in any condition.",
			"claim_type": "pricing_payment",
			"source": "",
			"source_type": "unverified",
			"confidence": "none",
			"risk": "medium",
			"status": "unresolved",
			"verification": "NOT_YET_CHECKED",
			"publishable": false,
			"appears_in_existing_copy": true,
			"source_page": "north-las-vegas",
			"notes": "Extracted from live copy. Being published is not evidence — this claim has no recorded source. Types detected: pricing_payment, service_guarantee, process_claim."
		},
		{
			"id": "north-las-vegas-01-every-pickup-north-las",
			"claim": "Every pickup in North Las Vegas includes free towing.",
			"claim_type": "service_guarantee",
			"source": "",
			"source_type": "unverified",
			"confidence": "none",
			"risk": "low",
			"status": "unresolved",
			"verification": "NOT_YET_CHECKED",
			"publishable": false,
			"appears_in_existing_copy": true,
			"source_page": "north-las-vegas",
			"notes": "Extracted from live copy. Being published is not evidence — this claim has no recorded source. Types detected: service_guarantee."
		},
		{
			"id": "north-las-vegas-02-give-cash-offer-spot",
			"claim": "We give you a cash offer on the spot — no waiting for callbacks, no haggling.",
			"claim_type": "pricing_payment",
			"source": "",
			"source_type": "unverified",
			"confidence": "none",
			"risk": "medium",
			"status": "unresolved",
			"verification": "NOT_YET_CHECKED",
			"publishable": false,
			"appears_in_existing_copy": true,
			"source_page": "north-las-vegas",
			"notes": "Extracted from live copy. Being published is not evidence — this claim has no recorded source. Types detected: pricing_payment."
		},
		{
			"id": "north-las-vegas-03-accept-offer-schedule-free",
			"claim": "Accept the offer and we schedule a free pickup at your North Las Vegas address.",
			"claim_type": "service_guarantee",
			"source": "",
			"source_type": "unverified",
			"confidence": "none",
			"risk": "low",
			"status": "unresolved",
			"verification": "NOT_YET_CHECKED",
			"publishable": false,
			"appears_in_existing_copy": true,
			"source_page": "north-las-vegas",
			"notes": "Extracted from live copy. Being published is not evidence — this claim has no recorded source. Types detected: service_guarantee."
		},
		{
			"id": "north-las-vegas-04-tow-truck-arrives-agreed",
			"claim": "Our tow truck arrives at the agreed time, we verify the vehicle, pay you in cash, and load it up.",
			"claim_type": "pricing_payment",
			"source": "",
			"source_type": "unverified",
			"confidence": "none",
			"risk": "medium",
			"status": "unresolved",
			"verification": "NOT_YET_CHECKED",
			"publishable": false,
			"appears_in_existing_copy": true,
			"source_page": "north-las-vegas",
			"notes": "Extracted from live copy. Being published is not evidence — this claim has no recorded source. Types detected: pricing_payment."
		},
		{
			"id": "north-las-vegas-05-most-north-las-vegas",
			"claim": "Most North Las Vegas sellers have the entire process completed within a few hours of their first call.",
			"claim_type": "process_claim",
			"source": "",
			"source_type": "unverified",
			"confidence": "none",
			"risk": "low",
			"status": "unresolved",
			"verification": "NOT_YET_CHECKED",
			"publishable": false,
			"appears_in_existing_copy": true,
			"source_page": "north-las-vegas",
			"notes": "Extracted from live copy. Being published is not evidence — this claim has no recorded source. Types detected: process_claim, unverifiable."
		},
		{
			"id": "north-las-vegas-06-blown-engines-bad-transmissions",
			"claim": "Blown engines, bad transmissions, body damage, rust, missing parts — we buy vehicles that most dealerships and private buyers won't touch.",
			"claim_type": "unverifiable",
			"source": "",
			"source_type": "unverified",
			"confidence": "none",
			"risk": "low",
			"status": "unresolved",
			"verification": "NOT_YET_CHECKED",
			"publishable": false,
			"appears_in_existing_copy": true,
			"source_page": "north-las-vegas",
			"notes": "Extracted from live copy. Being published is not evidence — this claim has no recorded source. Types detected: unverifiable."
		},
		{
			"id": "north-las-vegas-07-how-much-junk-car",
			"claim": "How much is my junk car worth in North Las Vegas?",
			"claim_type": "pricing_payment",
			"source": "",
			"source_type": "unverified",
			"confidence": "none",
			"risk": "medium",
			"status": "unresolved",
			"verification": "NOT_YET_CHECKED",
			"publishable": false,
			"appears_in_existing_copy": true,
			"source_page": "north-las-vegas",
			"notes": "Extracted from live copy. Being published is not evidence — this claim has no recorded source. Types detected: pricing_payment."
		},
		{
			"id": "north-las-vegas-08-offers-range-200-5",
			"claim": "Offers range from $200 to $5,000+ based on the vehicle's year, make, model, weight, and condition.",
			"claim_type": "pricing_payment",
			"source": "",
			"source_type": "unverified",
			"confidence": "none",
			"risk": "medium",
			"status": "unresolved",
			"verification": "NOT_YET_CHECKED",
			"publishable": false,
			"appears_in_existing_copy": true,
			"source_page": "north-las-vegas",
			"notes": "Extracted from live copy. Being published is not evidence — this claim has no recorded source. Types detected: pricing_payment."
		},
		{
			"id": "north-las-vegas-09-call-free-obligation-quote",
			"claim": "Call us for a free, no-obligation quote specific to your vehicle.",
			"claim_type": "pricing_payment",
			"source": "",
			"source_type": "unverified",
			"confidence": "none",
			"risk": "medium",
			"status": "unresolved",
			"verification": "NOT_YET_CHECKED",
			"publishable": false,
			"appears_in_existing_copy": true,
			"source_page": "north-las-vegas",
			"notes": "Extracted from live copy. Being published is not evidence — this claim has no recorded source. Types detected: pricing_payment, service_guarantee."
		},
		{
			"id": "north-las-vegas-10-yes-someone-needs-present",
			"claim": "Yes, someone needs to be present to sign the paperwork and receive payment.",
			"claim_type": "pricing_payment",
			"source": "",
			"source_type": "unverified",
			"confidence": "none",
			"risk": "medium",
			"status": "unresolved",
			"verification": "NOT_YET_CHECKED",
			"publishable": false,
			"appears_in_existing_copy": true,
			"source_page": "north-las-vegas",
			"notes": "Extracted from live copy. Being published is not evidence — this claim has no recorded source. Types detected: pricing_payment."
		},
		{
			"id": "nrs-487-290-two-unregistered-vehicles",
			"claim": "Nevada law limits a person to keeping no more than two unregistered vehicles on real property where those vehicles are no longer intended for, or in condition for, lawful use on the highway, subject to listed exceptions.",
			"claim_type": "government_legal_regulatory",
			"source": "NRS 487.290",
			"source_ids": [
				"nrs-487-290-two-vehicle-limit",
				"nlv-code-enforcement-junk-vehicles"
			],
			"source_type": "reputable_secondary",
			"verified_on": "2026-09-14",
			"review_by": "2027-03-14",
			"confidence": "medium",
			"risk": "high",
			"status": "researched",
			"verification": "PARTIALLY_SUPPORTED",
			"claim_boundary": "Nevada law places a separate statewide limit on unregistered vehicles that are unfit for highway use, which applies in addition to any local code. The exact figure and its exceptions must be confirmed against the Legislature's own text before the number is stated to a reader.",
			"publishable": false,
			"appears_in_existing_copy": false,
			"notes": "NOT PUBLISHABLE: high-risk regulatory claim resting on a secondary publisher. STATEWIDE, so it cannot differentiate any location page - the same rule that retired the Henderson HOA angle. IMPORTANT: this interacts with the live Henderson page, which states city caps of six/four/two without noting that a separate state limit may apply to the unregistered-and-unfit subset. Flagged for review; see the open question."
		},
		{
			"id": "nlv-incorporated-own-code-enforcement",
			"claim": "North Las Vegas is an incorporated city that enforces its own municipal code, including abatement of junk vehicles, through its own code enforcement division.",
			"claim_type": "government_legal_regulatory",
			"source": "City of North Las Vegas Code Enforcement; NLVMC chapters 8.32, 8.75, 10.61",
			"source_ids": [
				"nlv-code-enforcement-junk-vehicles"
			],
			"source_type": "official_government",
			"verified_on": "2026-09-14",
			"review_by": "2027-03-14",
			"confidence": "medium",
			"risk": "high",
			"status": "researched",
			"verification": "PARTIALLY_SUPPORTED",
			"claim_boundary": "North Las Vegas has its own code and enforcement division. What its provisions actually require is unknown.",
			"publishable": false,
			"appears_in_existing_copy": false,
			"notes": "True but empty for content purposes. Every incorporated city in the valley can say this, so on its own it differentiates nothing - the Henderson angle worked because its specific numbers were retrieved, not because Henderson is a city."
		}
	],
	"research_locked": true
}
