{
	"slug": "_shared-business",
	"generated": {
		"by": "business-config.php",
		"note": "Business-provided facts, owned by business-config.php and shared by every page. Kept in one file so a changed service promise is corrected once rather than in a dozen ledgers. Merged into every production brief by create-content-brief.py.",
		"created_on": "2026-09-14"
	},
	"research_locked": true,

	"claims": [
		{
			"id": "biz-free-towing",
			"claim": "Towing is free on every pickup, with no charge deducted from the offer.",
			"claim_type": "service_guarantee",
			"source": "business-config.php trust_items: 'Free towing, every time'",
			"source_ids": [ "waif-business-config" ],
			"source_type": "official_business",
			"verified_on": "2026-09-14",
			"review_by": "2027-09-14",
			"confidence": "high",
			"risk": "medium",
			"status": "verified",
			"verification": "SUPPORTED",
			"publishable": true,
			"appears_in_existing_copy": true,
			"notes": "A promise the business makes about its own service. Authoritative for that, and for nothing else."
		},
		{
			"id": "biz-same-day-pickup",
			"claim": "Same-day pickup is available.",
			"claim_type": "service_guarantee",
			"source": "business-config.php trust_items: 'Same-day pickup available'",
			"source_ids": [ "waif-business-config" ],
			"source_type": "official_business",
			"verified_on": "2026-09-14",
			"review_by": "2027-09-14",
			"confidence": "high",
			"risk": "medium",
			"status": "verified",
			"verification": "SUPPORTED",
			"publishable": true,
			"appears_in_existing_copy": true,
			"claim_boundary": "Available, not guaranteed. Write it as an option rather than a promise for every booking.",
			"notes": "The config says 'available'. Copy must not upgrade that to 'always' or 'guaranteed'."
		},
		{
			"id": "biz-no-hidden-fees",
			"claim": "There are no hidden fees; the quoted offer is what the seller receives.",
			"claim_type": "service_guarantee",
			"source": "business-config.php trust_items: 'No hidden fees, ever'",
			"source_ids": [ "waif-business-config" ],
			"source_type": "official_business",
			"verified_on": "2026-09-14",
			"review_by": "2027-09-14",
			"confidence": "high",
			"risk": "medium",
			"status": "verified",
			"verification": "SUPPORTED",
			"publishable": true,
			"appears_in_existing_copy": true,
			"notes": "Paired with the firm-offer claim; together they are the business's pricing promise."
		},
		{
			"id": "biz-no-title-help",
			"claim": "The business can often still help when the seller does not have the title.",
			"claim_type": "process_claim",
			"source": "business-config.php trust_items: 'No title? We can still help'",
			"source_ids": [ "waif-business-config" ],
			"source_type": "official_business",
			"verified_on": "2026-09-14",
			"review_by": "2027-09-14",
			"confidence": "high",
			"risk": "medium",
			"status": "verified",
			"verification": "SUPPORTED",
			"publishable": true,
			"appears_in_existing_copy": true,
			"claim_boundary": "The business can help; it does NOT follow that a sale without title is always possible. Never state a legal rule about title from this claim - that requires a DMV or statutory source.",
			"notes": "Deliberately bounded. This is where an unsupported legal claim would creep in, and did once already on the Henderson page."
		},
		{
			"id": "biz-three-step-process",
			"claim": "The process is three steps: call or request a quote, accept a firm cash offer, then the vehicle is collected and the seller is paid at pickup.",
			"claim_type": "process_claim",
			"source": "business-config.php how_it_works steps",
			"source_ids": [ "waif-business-config" ],
			"source_type": "official_business",
			"verified_on": "2026-09-14",
			"review_by": "2027-09-14",
			"confidence": "high",
			"risk": "low",
			"status": "verified",
			"verification": "SUPPORTED",
			"publishable": true,
			"appears_in_existing_copy": true,
			"notes": "The business's own description of how it operates."
		},
		{
			"id": "biz-firm-offer",
			"claim": "The offer quoted is firm; the amount agreed is the amount paid.",
			"claim_type": "pricing_payment",
			"source": "business-config.php how_it_works: 'Accept a Firm Cash Offer'",
			"source_ids": [ "waif-business-config" ],
			"source_type": "official_business",
			"verified_on": "2026-09-14",
			"review_by": "2027-09-14",
			"confidence": "high",
			"risk": "medium",
			"status": "verified",
			"verification": "SUPPORTED",
			"publishable": true,
			"appears_in_existing_copy": true,
			"claim_boundary": "The offer is firm once made. This says nothing about how much any particular vehicle is worth - no figure or range may be stated from this claim.",
			"notes": "Bounded deliberately. Dollar amounts are not business-provided facts and have no source."
		},
		{
			"id": "biz-paid-at-pickup",
			"claim": "Payment is made at pickup rather than afterwards.",
			"claim_type": "pricing_payment",
			"source": "business-config.php how_it_works: 'We Pick It Up and Pay You on the Spot'",
			"source_ids": [ "waif-business-config" ],
			"source_type": "official_business",
			"verified_on": "2026-09-14",
			"review_by": "2027-09-14",
			"confidence": "high",
			"risk": "medium",
			"status": "verified",
			"verification": "SUPPORTED",
			"publishable": true,
			"appears_in_existing_copy": true,
			"notes": "Config says 'on the spot'. Payment method is not specified there, so copy must not name cash or cheque specifically."
		},
		{
			"id": "biz-condition-agnostic",
			"claim": "Vehicles are bought running or not, damaged or complete.",
			"claim_type": "business_fact",
			"source": "business-config.php tagline and services cards",
			"source_ids": [ "waif-business-config" ],
			"source_type": "official_business",
			"verified_on": "2026-09-14",
			"review_by": "2027-09-14",
			"confidence": "high",
			"risk": "low",
			"status": "verified",
			"verification": "SUPPORTED",
			"publishable": true,
			"appears_in_existing_copy": true,
			"notes": "Supported by the tagline and by the four configured service categories."
		},
		{
			"id": "biz-hours",
			"claim": "Opening hours are Monday to Saturday 7:00 AM to 7:00 PM, and Sunday 9:00 AM to 4:00 PM.",
			"claim_type": "business_fact",
			"source": "business-config.php hours",
			"source_ids": [ "waif-business-config" ],
			"source_type": "official_business",
			"verified_on": "2026-09-14",
			"review_by": "2027-09-14",
			"confidence": "high",
			"risk": "low",
			"status": "verified",
			"verification": "SUPPORTED",
			"publishable": true,
			"appears_in_existing_copy": true,
			"notes": "Also rendered in the contact section and in LocalBusiness schema, so copy rarely needs to restate it."
		}
	]
}
